{
  "artifact_type": "review_record",
  "review_record_id": "review-posture-boundary-001",
  "reviewed_at": "2026-03-14T14:20:00Z",
  "subject_artifact_type": "handoff_artifact",
  "subject_ref": "examples/studio/scenarios/idea-to-handoff/handoff.artifact.json",
  "topic": "bounded handoff packet proceeds only into later human decision review",
  "lifecycle_state": "forwarded",
  "decision_type": "forward",
  "decision_codes": [
    "handoff_ready",
    "user_gate_required"
  ],
  "review_summary": "The handoff remains proposal-only, conflict-visible, and bounded enough to move into later human decision review under an explicit user gate rather than staying stalled locally.",
  "user_gate_status": "required_and_granted",
  "resulting_next_posture": "request_human_decision",
  "record_scope": "review_layer_only",
  "gate_report_refs": [
    "gate-idea-handoff-001"
  ],
  "open_conflicts": [
    "the threshold for escalation remains disputed",
    "The escalation threshold remains contested and must stay visible."
  ]
}
