{
  "artifact_type": "review_record",
  "review_record_id": "review-idea-proposal-001",
  "reviewed_at": "2026-03-13T20:10:00Z",
  "subject_artifact_type": "proposal_artifact",
  "subject_ref": "examples/studio/scenarios/idea-to-proposal/proposal.artifact.json",
  "topic": "Keep the contradiction logging proposal inside bounded review",
  "lifecycle_state": "held",
  "decision_type": "hold",
  "decision_codes": [
    "insufficient_evidence",
    "proposal_only_keep"
  ],
  "review_summary": "The proposal remains useful, but evidence is still too thin for stronger movement beyond local proposal review.",
  "user_gate_status": "not_required",
  "resulting_next_posture": "retain_in_review_layer",
  "record_scope": "review_layer_only",
  "gate_report_refs": [
    "gate-idea-proposal-001"
  ],
  "open_conflicts": [
    "The split threshold for a dedicated contradiction artifact remains unresolved."
  ]
}
