{
  "artifact_type": "review_record",
  "review_record_id": "review-idea-handoff-001",
  "reviewed_at": "2026-03-13T20:26:00Z",
  "subject_artifact_type": "handoff_artifact",
  "subject_ref": "examples/studio/scenarios/idea-to-handoff/handoff.artifact.json",
  "topic": "bounded handoff packet proceeds only into later human decision review",
  "lifecycle_state": "forwarded",
  "decision_type": "forward",
  "decision_codes": [
    "handoff_ready",
    "user_gate_required"
  ],
  "review_summary": "The handoff stays proposal-only and may move only into a later human-owned review context under the stated gate discipline.",
  "user_gate_status": "required_and_granted",
  "resulting_next_posture": "request_human_decision",
  "record_scope": "review_layer_only",
  "gate_report_refs": [
    "gate-idea-handoff-001"
  ],
  "open_conflicts": [
    "The escalation threshold remains contested and must stay visible."
  ]
}
